{
  "$id": "http://funny-bunny.xyz/cloudevents/jsonschema/merchant-account-management/v1/TransactionRegistered.json",
  "$schema": "https://json-schema.org/draft/2020-12/schema",
  "type": "object",
  "title": "Transaction Wallet Registered Event Schema",
  "description": "Schema for events triggered when a transaction is registered in a merchant's wallet, including comprehensive details about the transaction, seller, payment, payout, and associated metadata.",
  "properties": {
    "transaction": {
      "type": "object",
      "description": "Core transaction information that uniquely identifies this wallet registration event",
      "properties": {
        "id": {
          "type": "string",
          "description": "Unique identifier for the transaction wallet registration",
          "format": "uuid"
        }
      },
      "required": ["id"],
      "additionalProperties": false
    },
    "seller": {
      "type": "object",
      "description": "Information about the merchant whose wallet is receiving the transaction",
      "properties": {
        "sellerId": {
          "type": "string",
          "description": "Unique identifier of the seller/merchant",
          "format": "uuid"
        }
      },
      "required": ["sellerId"],
      "additionalProperties": false
    },
    "metadata": {
      "type": "object",
      "description": "Additional contextual information about the transaction, including payment and payout details",
      "properties": {
        "payment": {
          "$ref": "#/$defs/payment",
          "description": "Details about the original payment transaction"
        },
        "payout": {
          "$ref": "#/$defs/payout",
          "description": "Information about how and when the funds will be disbursed to the merchant"
        }
      },
      "required": ["payment", "payout"],
      "additionalProperties": false
    },
    "amount": {
      "type": "string",
      "description": "Transaction amount in decimal format (e.g., '100.00')",
      "pattern": "^\\d+\\.\\d{2}$"
    },
    "currency": {
      "type": "string",
      "description": "Three-letter ISO currency code",
      "pattern": "^[A-Z]{3}$",
      "examples": ["USD", "EUR", "BRL"]
    },
    "at": {
      "type": "string",
      "description": "Timestamp when the transaction was registered in the wallet",
      "format": "date-time"
    }
  },
  "required": ["transaction", "seller", "amount", "currency", "at", "metadata"],
  "$defs": {
    "buyer": {
      "type": "object",
      "description": "Information about the customer who made the payment",
      "properties": {
        "document": {
          "type": "string",
          "description": "Buyer's identification document (e.g., CPF, passport)",
          "pattern": "^[0-9]{3}\\.[0-9]{3}\\.[0-9]{3}-[0-9]{2}$"
        },
        "name": {
          "type": "string",
          "description": "Full name of the buyer",
          "minLength": 1
        }
      },
      "required": ["document", "name"],
      "additionalProperties": false
    },
    "checkout": {
      "type": "object",
      "description": "Reference to the checkout session that initiated the payment",
      "properties": {
        "id": {
          "type": "string",
          "description": "Unique identifier of the checkout session",
          "format": "uuid"
        }
      },
      "required": ["id"],
      "additionalProperties": false
    },
    "payment": {
      "type": "object",
      "description": "Comprehensive payment transaction details",
      "properties": {
        "id": {
          "type": "string",
          "description": "Unique identifier of the payment transaction",
          "format": "uuid"
        },
        "checkout": {
          "$ref": "#/$defs/checkout",
          "description": "Details of the checkout session associated with this payment"
        },
        "buyer": {
          "$ref": "#/$defs/buyer",
          "description": "Information about the customer who made the payment"
        },
        "status": {
          "type": "string",
          "description": "Current status of the payment",
          "enum": ["COMPLETED", "PENDING_SETTLEMENT"],
          "examples": ["COMPLETED"]
        }
      },
      "required": ["id", "checkout", "buyer", "status"],
      "additionalProperties": false
    },
    "payout": {
      "type": "object",
      "description": "Details about the merchant payout/settlement",
      "properties": {
        "id": {
          "type": "string",
          "description": "Unique identifier for the payout",
          "format": "uuid"
        },
        "scheduled_date": {
          "type": "string",
          "description": "Expected date when the funds will be transferred to the merchant",
          "format": "date"
        },
        "status": {
          "type": "string",
          "description": "Current status of the payout",
          "enum": ["SCHEDULED", "PROCESSING", "COMPLETED"],
          "examples": ["SCHEDULED"]
        }
      },
      "required": ["id", "scheduled_date", "status"],
      "additionalProperties": false
    }
  }
}
